{
  "$schema": "../../../schemas/plugin.manifest.schema.json",
  "id": "example.basic",
  "name": "Basic Example Plugin",
  "description": "Provides a demo resource and node type for validation.",
  "version": "0.1.0",
  "wbSpecVersion": "0.1.0",
  "deterministic": true,
  "permissions": [],
  "contributions": {
    "resources": [ { "id": "energy", "label": "Energy", "color": "#FACC15" } ],
    "nodeTypes": [
      {
        "id": "source.grid_tap",
        "kind": "source",
        "label": "Grid Tap",
        "params": { "capacityPerHour": 100 },
        "pins": { "in": [], "out": [ { "name": "power", "resource": "energy" } ] },
        "labor": { "opsPerHour": 0 },
        "maint": { "wearRatePerHour": 0.003 }
      }
    ]
  },
  "conflicts": { "provides": ["resource:energy", "nodeType:source.grid_tap"], "conflicts": [], "replaces": [] }
}

